uri,code,name
https://edmo.seadatanet.org/report/10,10,"University of Liverpool, Oceanographic Laboratories, Department of Earth Sciences"
https://edmo.seadatanet.org/report/100,100,Leibniz Institute for Baltic Sea Research Warnemünde
https://edmo.seadatanet.org/report/1000,1000,"CQEL Dieppe, Service Territorial et Maritime, Ministere de l'Equipement, des Transport et du Logement"
https://edmo.seadatanet.org/report/1001,1001,"Ifremer, Station d'Arcachon"
https://edmo.seadatanet.org/report/1002,1002,"Aquitaine Observatory of Sciences of the Universe, University of Bordeaux"
https://edmo.seadatanet.org/report/1004,1004,Hellenic Navy Hydrographic Service 
https://edmo.seadatanet.org/report/1006,1006,APAT of Venice (ex Istituto Idrografico e Mareografico di Venezia)
https://edmo.seadatanet.org/report/1007,1007,"Comune di Venezia, Centro Previsioni e Segnalazioni Maree"
https://edmo.seadatanet.org/report/1008,1008,Agency for Environmental Protection and Technical Services
https://edmo.seadatanet.org/report/1009,1009,"CNR, Istituto per l'Ambiente Marino Costiero (Sezione di Oristano)"
https://edmo.seadatanet.org/report/101,101,"Alfred Wegener Institute Helmholtz Centre for Polar and Marine Research, Wadden Sea Station Sylt"
https://edmo.seadatanet.org/report/1010,1010,"ARPA Friuli-Venezia Giulia, Alto Adriatico Observatory"
https://edmo.seadatanet.org/report/1011,1011,"Venice Water Authority, Consorzio Venezia Nuova"
https://edmo.seadatanet.org/report/1014,1014,"The Ministry of National Defense, General Command of Mapping"
https://edmo.seadatanet.org/report/1015,1015,"Oceanologic Observatory of Banyuls, University of Paris VI, OSU"
https://edmo.seadatanet.org/report/1016,1016,"Ifremer, DYNECO- Coastal Environment Dynamics department"
https://edmo.seadatanet.org/report/1017,1017,Societe ACRI S.A.
https://edmo.seadatanet.org/report/1018,1018,"CEA,  Service Mixte De Surveillance Radiologique Et Biologique"
https://edmo.seadatanet.org/report/102,102,Office of Schleswig-Holstein Wadden Sea National Park
https://edmo.seadatanet.org/report/1022,1022,French Geological Survey (BRGM)
https://edmo.seadatanet.org/report/1023,1023,"CETE Normandie Centre, Ministere de l'Equipement, des Transport et du Logement"
https://edmo.seadatanet.org/report/1024,1024,"Institut Geographique National, Département des grands clients"
https://edmo.seadatanet.org/report/1026,1026,"Museum National d'Histoire Naturelle, Unite Inventaire et Suivi de la Biodiversite "
https://edmo.seadatanet.org/report/1027,1027,"Universite de Montpellier II, Laboratoire de Geophysique et d'Hydrodynamique en Forage"
https://edmo.seadatanet.org/report/1028,1028,"Geology service, Mapping and geoinformation"
https://edmo.seadatanet.org/report/1029,1029,École Normale Supérieure Institute of Marine Biogeochemistry
https://edmo.seadatanet.org/report/103,103,"University of Hamburg, Institute of Meteorology"
https://edmo.seadatanet.org/report/1031,1031,"Ifremer, Centre Manche, Mer du Nord"
https://edmo.seadatanet.org/report/1032,1032,Black Sea Basin Directorate
https://edmo.seadatanet.org/report/1033,1033,"University of Antwerp, Department of Biology, Ecosystem Management Research Group"
https://edmo.seadatanet.org/report/1034,1034,Euras
https://edmo.seadatanet.org/report/1035,1035,"Université Catholique de Louvain, Marine Biology Laboratory"
https://edmo.seadatanet.org/report/1036,1036,Resource Analysis
https://edmo.seadatanet.org/report/1037,1037,"University of Antwerp, Department of Biology, Laboratory for Ecophysiology, Biochemistry and Toxicology"
https://edmo.seadatanet.org/report/1038,1038,"CEA, Dept Dase, Service TMG"
https://edmo.seadatanet.org/report/1039,1039,"CEA, Institut de  Radioprotection et de Surete Nucleaire"
https://edmo.seadatanet.org/report/1040,1040,"CETE, CETE Aix"
https://edmo.seadatanet.org/report/1041,1041,"CNEVA, Lab. Pathologie Animaux Aquatiques"
https://edmo.seadatanet.org/report/1042,1042,"CNRS, Insu Technical Division (Plouzané)"
https://edmo.seadatanet.org/report/1043,1043,"COM, Physical and Biogeochemical Oceanography Laboratory (Endoume)"
https://edmo.seadatanet.org/report/1044,1044,"CNRS, Institut de Geodynamique (Sophia Antipolis)"
https://edmo.seadatanet.org/report/1045,1045,"CNRS, Institut Pierre Simon Laplace "
https://edmo.seadatanet.org/report/1046,1046,"CNRS, Laboratory Of Sciences Of Marine Environment"
https://edmo.seadatanet.org/report/1047,1047,CREOCEAN
https://edmo.seadatanet.org/report/1048,1048,Dir. Departementale Equipement Finistere
https://edmo.seadatanet.org/report/1049,1049,Dir. Departementale Equipement Morbihan
https://edmo.seadatanet.org/report/105,105,Coastal Research Station of the NLOE
https://edmo.seadatanet.org/report/1050,1050,Dir. Departementale Equipement Vendee
https://edmo.seadatanet.org/report/1052,1052,GENAVIR Brest
https://edmo.seadatanet.org/report/1053,1053,"Ifremer, GENAVIR (La Seyne sur Mer)"
https://edmo.seadatanet.org/report/1054,1054,Ifremer Head Office
https://edmo.seadatanet.org/report/1056,1056,"Ifremer, Station de la Tremblade"
https://edmo.seadatanet.org/report/1057,1057,"Ifremer, TSI/AS, Acoustic Seismic"
https://edmo.seadatanet.org/report/1059,1059,French Petroleum Institute New Energies (Rueil-Malmaison)
https://edmo.seadatanet.org/report/106,106,"Alfred Wegener Institute Helmholtz Centre for Polar and Marine Research, Geophysics Department"
https://edmo.seadatanet.org/report/1060,1060,"Institut Geographique National, Ecole Nationale Des Sciences Geographiques"
https://edmo.seadatanet.org/report/1061,1061,Fugro France SA
https://edmo.seadatanet.org/report/1062,1062,"IRD, Centre de Cayenne- Guyane"
https://edmo.seadatanet.org/report/1063,1063,"IRD, Centre de la Martinique"
https://edmo.seadatanet.org/report/1064,1064,"IRD, Centre de la Reunion"
https://edmo.seadatanet.org/report/1065,1065,"IRD, Centre de Montpellier"
https://edmo.seadatanet.org/report/1066,1066,"IRD, Centre de Papeete"
https://edmo.seadatanet.org/report/107,107,"Alfred Wegener Institute Helmholtz Centre for Polar and Marine Research, Nutrient Group"
https://edmo.seadatanet.org/report/1070,1070,National Center for Meteorological Research (Paris)
https://edmo.seadatanet.org/report/1071,1071,SESAM
https://edmo.seadatanet.org/report/1073,1073,"Universite d'Orleans, Laboratoire Geologie Dynamique Orleans"
https://edmo.seadatanet.org/report/1074,1074,"University of Bordeaux I, Center for study of tropical geography"
https://edmo.seadatanet.org/report/1075,1075,"University of Bordeaux I, IGBA Talence"
https://edmo.seadatanet.org/report/1076,1076,"University of Bordeaux I, Amenagement institute"
https://edmo.seadatanet.org/report/1077,1077,"University of Bordeaux I, Marine Biology Institut"
https://edmo.seadatanet.org/report/108,108,"CNR, Istituto di Scienze Marine (Sezione di Venezia)"
https://edmo.seadatanet.org/report/1081,1081,"Universite de Bretagne-Sud, Geosciences, LAUBS"
https://edmo.seadatanet.org/report/1082,1082,"Universite de Corse, CEVAREN"
https://edmo.seadatanet.org/report/1083,1083,"University of Grenoble 1, Laboratory of Geophysical and Industrial Flows"
https://edmo.seadatanet.org/report/1085,1085,"Universite de la Mediterrannee (U2), Equipe Intec, COM"
https://edmo.seadatanet.org/report/1086,1086,"Universite de la Mediterrannee (U2), Laboratoire d'Hydrobiologie Marine"
https://edmo.seadatanet.org/report/1087,1087,"Universite de Montpellier II, Laboratoire de Geophysique et Tectonique"
https://edmo.seadatanet.org/report/1088,1088,Geosciences Montpellier
https://edmo.seadatanet.org/report/1089,1089,"Universite de Nantes, Laboratoire de Geologie Marine et Appliquee"
https://edmo.seadatanet.org/report/1090,1090,"Universite de Nantes, Laboratoire de Petrologie Structurale"
https://edmo.seadatanet.org/report/1092,1092,"Universite de Paris VI, Laboratoire de Geologie Dynamique Paris"
https://edmo.seadatanet.org/report/1094,1094,"Universite de Pau, Lab. Chimie Bio Inorganique et Environnement"
https://edmo.seadatanet.org/report/1095,1095,"University Rennes I, Rennes GEOSCIENCES"
https://edmo.seadatanet.org/report/1096,1096,"University of Rouen Normandy, M2C - Continental and Coastal Morphodynamics - UMR 6143"
https://edmo.seadatanet.org/report/1097,1097,"University of Strasbourg I (Louis Pasteur), Earth Sciences School and Observatory"
https://edmo.seadatanet.org/report/1098,1098,"Department of Biological and Environmental Sciences, Aquatic Sciences, University of Helsinki"
https://edmo.seadatanet.org/report/1099,1099,"Technical University of Denmark, DTU Environment, Department of Environmental Engineering."
https://edmo.seadatanet.org/report/11,11,University Marine Biological Station (Millport)
https://edmo.seadatanet.org/report/110,110,"ENEA Centro Ricerche, Frascati"
https://edmo.seadatanet.org/report/1102,1102,"Danish Institute for Fisheries Research, Dept. of Marine Fisheries"
https://edmo.seadatanet.org/report/1103,1103,"Aarhus University, Department of Bioscience,Wildlife Ecology and Biodiversity"
https://edmo.seadatanet.org/report/1104,1104,Finnish Environment Institute
https://edmo.seadatanet.org/report/1107,1107,Countryside Council for Wales
https://edmo.seadatanet.org/report/1108,1108,Northern Ireland Environment Agency
https://edmo.seadatanet.org/report/1109,1109,"Queens University Belfast, Department of Agriculture and Environmental Science"
https://edmo.seadatanet.org/report/111,111,"Federal Maritime and Hydrographic Agency, Dept. Ocean Currents"
https://edmo.seadatanet.org/report/1110,1110,Channel Coastal Observatory
https://edmo.seadatanet.org/report/1111,1111,Icelandic Maritime Administration
https://edmo.seadatanet.org/report/1112,1112,Icelandic Coast Guard Hydrographic Department
https://edmo.seadatanet.org/report/1114,1114,Municipality of Landskrona
https://edmo.seadatanet.org/report/1115,1115,Institute of Ecology of Nature Research Centre
https://edmo.seadatanet.org/report/1116,1116,"Lithuanian State Pisciculture and Fisheries Research Center, Fishery Research Laboratory"
https://edmo.seadatanet.org/report/1117,1117,Coastal Research and Planning Institute
https://edmo.seadatanet.org/report/1118,1118,Central Laboratory of Geodesy
https://edmo.seadatanet.org/report/1119,1119,"Hydrographic service, Naval forces, Hydrographic Department"
https://edmo.seadatanet.org/report/112,112,"Federal Maritime and Hydrographic Agency, Dept. Operational Modelling"
https://edmo.seadatanet.org/report/1120,1120,"Regional Inspection of Environment and Waters, Varna"
https://edmo.seadatanet.org/report/1121,1121,"Regional Inspection of Environment and Waters, Burgas"
https://edmo.seadatanet.org/report/1122,1122,"Geological Institute, Department of Marine Geology"
https://edmo.seadatanet.org/report/1123,1123,State Hydrographical Service of Georgia
https://edmo.seadatanet.org/report/1125,1125,Poti  Sea Port Ltd.
https://edmo.seadatanet.org/report/1126,1126,Marine Institute (Newport Facility)
https://edmo.seadatanet.org/report/1128,1128,"National Agricultural Research Foundation, Fisheries Research Institute"
https://edmo.seadatanet.org/report/1129,1129,National Center for Meteorology and Aeronautical Climatology
https://edmo.seadatanet.org/report/113,113,"Federal Maritime and Hydrographic Agency, Dept. Tides"
https://edmo.seadatanet.org/report/1130,1130,"ARPA Emilia-Romagna, Struttura Oceanografica Daphne"
https://edmo.seadatanet.org/report/1132,1132,"ARPA Veneto, Centro Meteorologico di Teolo"
https://edmo.seadatanet.org/report/1133,1133,General Office for Air Force Meteorology
https://edmo.seadatanet.org/report/1134,1134,Provincia di Sassari
https://edmo.seadatanet.org/report/1135,1135,Royal Danish Navy
https://edmo.seadatanet.org/report/1138,1138,Experimental Branch of Marine Hydrophysical Institute
https://edmo.seadatanet.org/report/1139,1139,Municipal Water and Sewerage Enterprise of Volos Greater Area 
https://edmo.seadatanet.org/report/114,114,"Federal Maritime and Hydrographic Agency, Dept. Waves"
https://edmo.seadatanet.org/report/1140,1140,"Tsivos Laboratories, Examination center of quality for water and foods"
https://edmo.seadatanet.org/report/1144,1144,"IRD, Centre of Madagascar"
https://edmo.seadatanet.org/report/1145,1145,"IRD, Centre of Abidjan"
https://edmo.seadatanet.org/report/1146,1146,"IRD, Centre of Pointe Noire"
https://edmo.seadatanet.org/report/1147,1147,"IRD, Centre of Hann"
https://edmo.seadatanet.org/report/1148,1148,"IRD, Centre of Jakarta"
https://edmo.seadatanet.org/report/1149,1149,"UNESCO, Intergovernmental Oceanographic Commission Project Office for IODE"
https://edmo.seadatanet.org/report/1150,1150,National office for environment and nature Stralsund
https://edmo.seadatanet.org/report/1151,1151,Max-Planck Institute for Marine Microbiology
https://edmo.seadatanet.org/report/1152,1152,Helmholtz Centre for Environmental Research GmbH - UFZ
https://edmo.seadatanet.org/report/1154,1154,"Westfaelische Wilhelms, University of Muenster"
https://edmo.seadatanet.org/report/1155,1155,Johannes Gutenberg University Mainz
https://edmo.seadatanet.org/report/1156,1156,"University of Hamburg, Institute of Oceanography"
https://edmo.seadatanet.org/report/1157,1157,University of Bremen
https://edmo.seadatanet.org/report/1158,1158,Technical University of Berlin
https://edmo.seadatanet.org/report/1159,1159,"Institute and Museum for Geology and Paleontology, University of Tuebingen"
https://edmo.seadatanet.org/report/116,116,"Baltic Sea Research Institute Warnemuende, Marine Geology Department"
https://edmo.seadatanet.org/report/1161,1161,Research Centre Juelich GmbH
https://edmo.seadatanet.org/report/1162,1162,"Technical University of Munich, Lehrstuhl fuer Bioklimatologie und Immissionsforschung"
https://edmo.seadatanet.org/report/1163,1163,SIMORC service
https://edmo.seadatanet.org/report/1164,1164,Technical University Varna
https://edmo.seadatanet.org/report/1165,1165,Black Sea NGO Network
https://edmo.seadatanet.org/report/1167,1167,Ukrainian scientific center of Ecology of Sea 
https://edmo.seadatanet.org/report/1168,1168,Scientific Research Institute of Ecological Problems 
https://edmo.seadatanet.org/report/1169,1169,Odessa National I.I.Mechnikov University
https://edmo.seadatanet.org/report/117,117,"Federal Maritime and Hydrographic Agency, Dept. Oceanography"
https://edmo.seadatanet.org/report/1171,1171,Bulgarian Cartographic Service
https://edmo.seadatanet.org/report/1173,1173,Hapag-Lloyd AG
https://edmo.seadatanet.org/report/1174,1174,Hamburg Sued
https://edmo.seadatanet.org/report/1175,1175,"Federal Ministry of Food, Agriculture and Consumer Protection "
https://edmo.seadatanet.org/report/1176,1176,Bundesamt fur Landwirtschaft und Ernahrung 
https://edmo.seadatanet.org/report/1177,1177,Water- and Shipping Directorate North 
https://edmo.seadatanet.org/report/1178,1178,Waterways and Shipping Office Cuxhaven
https://edmo.seadatanet.org/report/1179,1179,Waterways and Shipping Office Bremerhaven 
https://edmo.seadatanet.org/report/1180,1180,Water and Shipping Directorate Northwest
https://edmo.seadatanet.org/report/1182,1182,Waterways and Shipping Office Toenning 
https://edmo.seadatanet.org/report/1183,1183,"Federal Environment Agency, Environmental Specimen Bank "
https://edmo.seadatanet.org/report/1185,1185,Kaabeltau OÜ
https://edmo.seadatanet.org/report/1187,1187,The Finnish Game and Fisheries Research Institute 
https://edmo.seadatanet.org/report/1188,1188,Finnlines Plc
https://edmo.seadatanet.org/report/1189,1189,Centre National d'Etudes Spatiales 
https://edmo.seadatanet.org/report/119,119,"University of Trieste, Department of Geological, Environmental and Marine Sciences"
https://edmo.seadatanet.org/report/1190,1190,"Meteo France, Centre de Météorologie Marine"
https://edmo.seadatanet.org/report/1192,1192,"Service Maritime et de Navigation du Languedoc, Roussillon "
https://edmo.seadatanet.org/report/1198,1198,IGN France International
https://edmo.seadatanet.org/report/12,12,"University of Newcastle upon Tyne, Department of Physics"
https://edmo.seadatanet.org/report/120,120,"National Institute of Oceanography and Applied Geophysics - OGS, Division of Oceanography"
https://edmo.seadatanet.org/report/1201,1201,Muir Matheson
https://edmo.seadatanet.org/report/1202,1202,"National Observatory of Athens, Institute for Space Applications & Remote Sensing "
https://edmo.seadatanet.org/report/1204,1204,P&O Maritime Services (Ireland)
https://edmo.seadatanet.org/report/1205,1205,Israel Electric Company
https://edmo.seadatanet.org/report/1206,1206,"CNR, Istituto di Studi sui Sistemi Intelligenti per l'Automazione (Sezione di Genova)"
https://edmo.seadatanet.org/report/1207,1207,"ARPA Veneto, Osservatorio Regionale Acque"
https://edmo.seadatanet.org/report/1208,1208,"ARPA Emilia-Romagna, Servizio Meteorologico Regionale"
https://edmo.seadatanet.org/report/1209,1209,"CNR, Istituto di Scienze Marine (Sezione di Venezia, ex ISDGM)"
https://edmo.seadatanet.org/report/121,121,"Universita' di Venezia, Dipartimento di Scienze Ambientali, Sezione Geo-Mineralogica"
https://edmo.seadatanet.org/report/1210,1210,"Italian Ministry of Environment, Sea Protection Service "
https://edmo.seadatanet.org/report/1211,1211,ARPA Lazio
https://edmo.seadatanet.org/report/1212,1212,Norwegian Meteorological Institute
https://edmo.seadatanet.org/report/1213,1213,Swedish Coast Guard
https://edmo.seadatanet.org/report/1214,1214,TT Line
https://edmo.seadatanet.org/report/1215,1215,Swedish Maritime Administration
https://edmo.seadatanet.org/report/1216,1216,AS Tallink Grupp
https://edmo.seadatanet.org/report/1217,1217,Swedish Armed Forces
https://edmo.seadatanet.org/report/1218,1218,Stena Line
https://edmo.seadatanet.org/report/122,122,"ENEL SPA, Centro Ricerca Idraulica e Strutturale, Servizio Idrologico"
https://edmo.seadatanet.org/report/1224,1224,"National Aeronautics and Space Administration, Jet Propulsion Laboratory "
https://edmo.seadatanet.org/report/1225,1225,"National Aeronautics and Space Administration, Goddard Space Flight Center"
https://edmo.seadatanet.org/report/1226,1226,"National Oceanic and Atmospheric Administration, National Environmental Satellite, Data, and Information Service"
https://edmo.seadatanet.org/report/1228,1228,"Polytechnic University of Tirana, Institute of GeoSciences, Energy, Water and Environment"
https://edmo.seadatanet.org/report/1229,1229,"National Institute of Biology, Marine Biology Station"
https://edmo.seadatanet.org/report/123,123,"CNR, Istituto di Ricerca sulle Acque"
https://edmo.seadatanet.org/report/1230,1230,National Center for Marines Sciences
https://edmo.seadatanet.org/report/1231,1231,Ecole Nationale Superieure des Sciences de la Mer et de l Amenagement du Littoral
https://edmo.seadatanet.org/report/1232,1232,Institut National des Sciences et Technologies de la Mer
https://edmo.seadatanet.org/report/1233,1233,Collecte Localisation Satellites SA
https://edmo.seadatanet.org/report/1235,1235,Shell International Exploration & Production BV
https://edmo.seadatanet.org/report/1236,1236,Total SA
https://edmo.seadatanet.org/report/1237,1237,"Institute of Hydroengineering, Polish Academy of Sciences, Department of Wave Mechanics and Structural Dynamics"
https://edmo.seadatanet.org/report/1238,1238,"Institute of Hydroengineering, Polish Academy of Science, Department of Coastal Engineering and Dynamics"
https://edmo.seadatanet.org/report/1239,1239,"Institute of Hydroengineering, Polish Academy of Sciences, Department of Hydrodynamics of Rivers and Water Reservoirs"
https://edmo.seadatanet.org/report/1240,1240,"Maritime Institute in Gdansk, Department of Environment Protection"
https://edmo.seadatanet.org/report/1241,1241,"Maritime Institute in Gdansk, Department of Operational Oceanography"
https://edmo.seadatanet.org/report/1242,1242,Maritime Office in Gdynia
https://edmo.seadatanet.org/report/1243,1243,Maritime Office in Szczecin
https://edmo.seadatanet.org/report/1244,1244,Maritime Office in Slupsk
https://edmo.seadatanet.org/report/1245,1245,"Medical University of Gdansk, Interfaculty Institute of Maritime and Tropical Medicine"
https://edmo.seadatanet.org/report/1246,1246,Voivodship Sanitary and Epidemiological Station in Gdansk
https://edmo.seadatanet.org/report/1247,1247,Regional Inspectorate of Environmental Protection in Gdansk
https://edmo.seadatanet.org/report/1249,1249,Regional Inspectorate of Environmental Protection in Olsztyn
https://edmo.seadatanet.org/report/125,125,"Telespazio s.p.a., Earth Observation Division"
https://edmo.seadatanet.org/report/1255,1255,"Gdansk University of Technology, Faculty of Chemistry"
https://edmo.seadatanet.org/report/1256,1256,"Gdansk University of Technology, Faculty of Ocean Engineering and Ship Technology"
https://edmo.seadatanet.org/report/1257,1257,"Gdansk University of Technology, Faculty of Civil and Environmental Engineering"
https://edmo.seadatanet.org/report/1258,1258,"University of Szczecin, Institute of Marine Science"
https://edmo.seadatanet.org/report/1259,1259,West Pomeranian University of Technology in Szczecin
https://edmo.seadatanet.org/report/1265,1265,"Scientific, Research Firm ""GAMMA"""
https://edmo.seadatanet.org/report/127,127,"CNR, National Research Council, Institute of Marine Science (Trieste)"
https://edmo.seadatanet.org/report/130,130,Istituto Zooprofilattico Sperimentale dell'Abruzzo e del Molise 'G. Caporale' (Sezione di Pescara)
https://edmo.seadatanet.org/report/131,131,"University of Trieste, Department of Biology"
https://edmo.seadatanet.org/report/1324,1324,"Senckenberg by the Sea, Wilhelmshaven"
https://edmo.seadatanet.org/report/1326,1326,"Institute of Biochemistry and Food Chemistry, University Hamburg"
https://edmo.seadatanet.org/report/1327,1327,"Lower Saxony Water Management, Coastal Defense and Nature Conservation Agency"
https://edmo.seadatanet.org/report/1329,1329,Weser River Management Bureau
https://edmo.seadatanet.org/report/1330,1330,AVISO
https://edmo.seadatanet.org/report/1331,1331,"Centre National d'Etudes Spatiales, Toulouse Spatial Center"
https://edmo.seadatanet.org/report/1332,1332,"University of Gothenburg, Department of Marine Ecology"
https://edmo.seadatanet.org/report/1333,1333,The Centre for Reproductive Biology in Uppsala
https://edmo.seadatanet.org/report/1334,1334,"University of Gothenburg, Faculty of Science"
https://edmo.seadatanet.org/report/1335,1335,"Institute For Marine And Coastal Research, University Of Dubrovnik"
https://edmo.seadatanet.org/report/1336,1336,"University of Leeds, School of Earth and Environment"
https://edmo.seadatanet.org/report/1338,1338,Italian Hydrographic Institute
https://edmo.seadatanet.org/report/134,134,"CNR, Institute of Marine Sciences S.S. of Lerici (SP)"
https://edmo.seadatanet.org/report/1340,1340,"Wageningen Marine Research, IJmuiden"
https://edmo.seadatanet.org/report/1341,1341,University of Limerick
https://edmo.seadatanet.org/report/1343,1343,Maynooth University
https://edmo.seadatanet.org/report/1344,1344,"South East Technological University, Carlow"
https://edmo.seadatanet.org/report/1345,1345,CINTAL
https://edmo.seadatanet.org/report/1346,1346,National Institute of Fisheries
https://edmo.seadatanet.org/report/1347,1347,"Laboratory of Space Technology, Helsinki University of Technology"
https://edmo.seadatanet.org/report/1348,1348,"Zoological Museum, Natural History Museum, University of Copenhagen"
https://edmo.seadatanet.org/report/1349,1349,Norwegian Polar Institute
https://edmo.seadatanet.org/report/135,135,ENEA Centro Ricerche Casaccia (Roma)
https://edmo.seadatanet.org/report/1350,1350,"Norwegian College of Fishery and Science, University of Tromsø"
https://edmo.seadatanet.org/report/1351,1351,Institute of Marine Research
https://edmo.seadatanet.org/report/1352,1352,"Georgian National Museum, Institute of Palaeobiology"
https://edmo.seadatanet.org/report/1353,1353,Swedish Environmental Protection Agency
https://edmo.seadatanet.org/report/1354,1354,The Swedish Board of Fisheries
https://edmo.seadatanet.org/report/1355,1355,Netherlands Organisation for Scientific Research
https://edmo.seadatanet.org/report/1356,1356,Senter NOVEM
https://edmo.seadatanet.org/report/1357,1357,NoordzeeWind BV
https://edmo.seadatanet.org/report/136,136,ENEA Centro Ricerche Ambiente Marino (La Spezia)
https://edmo.seadatanet.org/report/1360,1360,Hydrographic Office of the Polish Navy
https://edmo.seadatanet.org/report/1362,1362,"Hydrographic Institute, Hydrographic Surveying Vessel Task Group"
https://edmo.seadatanet.org/report/1363,1363,French Polar Institute Paul-Emile Victor
https://edmo.seadatanet.org/report/1364,1364,"MAPA, General Secretariat of Maritime Fishing "
https://edmo.seadatanet.org/report/1365,1365,German Research Foundation 
https://edmo.seadatanet.org/report/1366,1366,"PtJ, Research Centre Juelich GmbH"
https://edmo.seadatanet.org/report/1367,1367,National Research Council
https://edmo.seadatanet.org/report/1368,1368,Alfred Wegener Institute Helmholtz Centre for Polar and Marine Research
https://edmo.seadatanet.org/report/137,137,"Universita' di Firenze, Laboratorio di Ecologia, Dipartimento di Biologia Vegetale"
https://edmo.seadatanet.org/report/1371,1371,Isle of Man Government Laboratory
https://edmo.seadatanet.org/report/1374,1374,"Welsh Assembly Government, Department for Sustainability and Rural Development"
https://edmo.seadatanet.org/report/1375,1375,"Joint Nature Conservation Committee, Aberdeen Office"
https://edmo.seadatanet.org/report/1379,1379,Shetland Oil Terminal Environmental Advisory Group
https://edmo.seadatanet.org/report/138,138,"University of Genova, Laboratory of Marine Geology and Sedimentology,  Dpt for the Study of the Territory and Resources"
https://edmo.seadatanet.org/report/1380,1380,Woods Hole Oceanographic Institution: Department of Physical Oceanography
https://edmo.seadatanet.org/report/1381,1381,National Science Foundation 
https://edmo.seadatanet.org/report/1382,1382,"Rosenstiel School of Marine and Atmospheric Science , University of Miami"
