uri,code,name
https://edmo.seadatanet.org/report/2700,2700,Kiev National T.G.Shevchenko University
https://edmo.seadatanet.org/report/2704,2704,Ukrainean State Institute of Geological Survey
https://edmo.seadatanet.org/report/2705,2705,Odessa State Environmental University
https://edmo.seadatanet.org/report/2707,2707,"Scientific Research Center, Hydrometproject Ltd."
https://edmo.seadatanet.org/report/2708,2708,National committee on hydrometeorology at the Cabinet ministry of Turkmenistan 
https://edmo.seadatanet.org/report/2709,2709,Astrakhan branch of the All-Russian Society of Nature Protection 
https://edmo.seadatanet.org/report/2710,2710,Federal Service for Hydrometeorology and Environmental Monitoring 
https://edmo.seadatanet.org/report/2711,2711,State Hydrochemical Institute of ROSHYDROMET 
https://edmo.seadatanet.org/report/2712,2712,Jundi-Shapur University of Technology 
https://edmo.seadatanet.org/report/2713,2713,Federal State Unitary Geological Enterprise Volgageologiya
https://edmo.seadatanet.org/report/2714,2714,Le Havre Large Seaport
https://edmo.seadatanet.org/report/2715,2715,Department of Energy & Climate Change
https://edmo.seadatanet.org/report/2716,2716,"Florida State University, Department of Oceanography"
https://edmo.seadatanet.org/report/2719,2719,"University of Hull, Centre for Environmental and Marine Sciences"
https://edmo.seadatanet.org/report/2720,2720,"National Institute of Nuclear Physics, Catania"
https://edmo.seadatanet.org/report/2721,2721,"University of Padova, Department of Biology"
https://edmo.seadatanet.org/report/2722,2722,"University of Genova, Department of Chemistry"
https://edmo.seadatanet.org/report/2723,2723,"University of Warwick, School of Life Sciences"
https://edmo.seadatanet.org/report/2725,2725,EKOL
https://edmo.seadatanet.org/report/2726,2726,Briggs Marine
https://edmo.seadatanet.org/report/2727,2727,"P.P.Shirshov Institute of Oceanology, Caspian branch"
https://edmo.seadatanet.org/report/2728,2728,Islamic Republic of Iran Meteorology Organization
https://edmo.seadatanet.org/report/2729,2729,"University of Aberystwyth, Institute of Geography and Earth Sciences"
https://edmo.seadatanet.org/report/273,273,"Hellenic Centre for Marine Research, Institute of Oceanography, Biological Oceanographic Department "
https://edmo.seadatanet.org/report/2731,2731,Fudan University Department of Environmental Science and Engineering
https://edmo.seadatanet.org/report/2732,2732,The Shark Trust
https://edmo.seadatanet.org/report/2733,2733,"GeoData Institute, University of Southampton"
https://edmo.seadatanet.org/report/2734,2734,Thomson Unicomarine
https://edmo.seadatanet.org/report/2735,2735,Data Archive for Marine Species and Habitats
https://edmo.seadatanet.org/report/2736,2736,Azerbaijan State Maritime Administration
https://edmo.seadatanet.org/report/2737,2737,The azerbaijan state caspian shipping company 
https://edmo.seadatanet.org/report/2738,2738,Azerbaijan State Marine Academy
https://edmo.seadatanet.org/report/2739,2739,Institute of Petrochemical Processes named after Yu.G.Mamedaliyev
https://edmo.seadatanet.org/report/274,274,"Hellenic Centre for Marine Research, Institute of Oceanography, Chemical Oceanographic Department "
https://edmo.seadatanet.org/report/2740,2740,Institute of Cybernetics named after Academician A.Huseynov
https://edmo.seadatanet.org/report/2741,2741,Institute of Radiation Problems
https://edmo.seadatanet.org/report/2742,2742,Institute of Botany
https://edmo.seadatanet.org/report/2743,2743,Institute of Soil Science and Agro Chemistry
https://edmo.seadatanet.org/report/2745,2745,"University of Oxford, Department of Physics"
https://edmo.seadatanet.org/report/2746,2746,"Joint Nature Conservation Committee, Peterborough Office"
https://edmo.seadatanet.org/report/2747,2747,Vattenfall Wind Power Ltd
https://edmo.seadatanet.org/report/2748,2748,"University of Liverpool, School of Environmental Sciences"
https://edmo.seadatanet.org/report/2749,2749,Foundation of the Faculty of Science University of Lisbon
https://edmo.seadatanet.org/report/275,275,"Hellenic Centre for Marine Research, Institute of Oceanography, Geological Oceanographic Department "
https://edmo.seadatanet.org/report/2750,2750,"Scottish Environment Protection Agency, Dingwall Office"
https://edmo.seadatanet.org/report/2751,2751,Puertos del Estado
https://edmo.seadatanet.org/report/2752,2752,BP Azerbaijan SPU
https://edmo.seadatanet.org/report/2753,2753,Total E&P Absheron
https://edmo.seadatanet.org/report/2754,2754,Centrica Energy Renewable Investments
https://edmo.seadatanet.org/report/2755,2755,"University of Connecticut, Marine Sciences"
https://edmo.seadatanet.org/report/2757,2757,Regione Calabria
https://edmo.seadatanet.org/report/2758,2758,The European Marine Energy Centre Limited
https://edmo.seadatanet.org/report/2759,2759,"Memorial University of Newfoundland, Fisheries and Marine Institute"
https://edmo.seadatanet.org/report/276,276,"Hellenic Centre for Marine Research, Institute of Oceanography, Physical Oceanographic Department "
https://edmo.seadatanet.org/report/2761,2761,Specialized Center for Hydrometeorology and Monitoring of Environment of Black and Azov Seas 
https://edmo.seadatanet.org/report/2762,2762,Metocean Services International Ltd
https://edmo.seadatanet.org/report/2763,2763,Marine Conservation Society
https://edmo.seadatanet.org/report/2764,2764,ETT S.p.A.
https://edmo.seadatanet.org/report/2765,2765,en:mapping
https://edmo.seadatanet.org/report/2766,2766,Associated British Ports
https://edmo.seadatanet.org/report/277,277,"National Centre for Scientific Research 'Demokritos', Institute of Biology, Hydrobiology Laboratory "
https://edmo.seadatanet.org/report/2771,2771,Sustainable Energy Authority of Ireland (SEAI)
https://edmo.seadatanet.org/report/2772,2772,Irish Maritime & Energy Research Cluster
https://edmo.seadatanet.org/report/2775,2775,Bantry Marine Research Station
https://edmo.seadatanet.org/report/2776,2776,"Centre for Renewable Energy, DKIT"
https://edmo.seadatanet.org/report/2778,2778,"Middle East Technical University, Department of Environmental Engineering"
https://edmo.seadatanet.org/report/2779,2779,Zonguldak Karaelmas University
https://edmo.seadatanet.org/report/278,278,Foundation Institute of Litoral Ecology 
https://edmo.seadatanet.org/report/2780,2780,"Sakarya University, Faculty of Art and Science"
https://edmo.seadatanet.org/report/2781,2781,"University of Ordu, Faculty of Fatsa Marine Sciences "
https://edmo.seadatanet.org/report/2782,2782,"Mersin University, Fisheries Faculty "
https://edmo.seadatanet.org/report/2783,2783,"Ataturk Universitesi, Faculty of Agriculture "
https://edmo.seadatanet.org/report/2784,2784,Kuban State University
https://edmo.seadatanet.org/report/2785,2785,Ministry of Natural Resources of Russian Federation
https://edmo.seadatanet.org/report/2786,2786,"Center of International Projects, Ministry of Natural Resources of Russian Federation"
https://edmo.seadatanet.org/report/2787,2787,Russian Federation Federal Agency for Fisheries
https://edmo.seadatanet.org/report/2788,2788,"Krasnodar Regional Nongovernment Organization ""Ecological course"" "
https://edmo.seadatanet.org/report/279,279,"CSIC, Institute of Marine Research"
https://edmo.seadatanet.org/report/2790,2790,"Institute of Applied Physics, Russian Academy of Sciences"
https://edmo.seadatanet.org/report/2791,2791,Neftegasgeodezia Ltd.
https://edmo.seadatanet.org/report/2792,2792,"National Academy of Sciences of Ukraine, Department of Marine Geology and Sedimentary Ore-Formation"
https://edmo.seadatanet.org/report/2793,2793,"Institute of Hydrobiology, NASU"
https://edmo.seadatanet.org/report/2795,2795,"Varna Free University, Chernorizets Hrabar"
https://edmo.seadatanet.org/report/2796,2796,Institute for Ecological Modernisation
https://edmo.seadatanet.org/report/2797,2797,"Institute of Geography, Romanian Academy"
https://edmo.seadatanet.org/report/2798,2798,Non-native Species Secretariat
https://edmo.seadatanet.org/report/2799,2799,"University of Littoral Cote d'Opale, Departement Genie Biologique"
https://edmo.seadatanet.org/report/28,28,"Centre for Environment, Fisheries and Aquaculture Science, Lowestoft Laboratory"
https://edmo.seadatanet.org/report/280,280,"CSIC, Institute of Marine Sciences"
https://edmo.seadatanet.org/report/2800,2800,Institute of Geophysics
https://edmo.seadatanet.org/report/2801,2801,Romanian Space Agency
https://edmo.seadatanet.org/report/2802,2802,SO.PRO.MAR SpA
https://edmo.seadatanet.org/report/2803,2803,Directorate for Coast and Sea Sustainability. Ministry for Ecological Transition
https://edmo.seadatanet.org/report/2804,2804,EDP Renewables
https://edmo.seadatanet.org/report/2805,2805,Moray Offshore Renewables Ltd
https://edmo.seadatanet.org/report/2806,2806,Directorate for Coast and Sea Sustainability. Ministry for Ecological Transition
https://edmo.seadatanet.org/report/2807,2807,Greenland Institute of Natural Resources
https://edmo.seadatanet.org/report/281,281,"National Centre for Scientific Research 'Demokritos', Institute of Physical Chemistry, Radioanalytical Laboratory "
https://edmo.seadatanet.org/report/2810,2810,"Bangor University, School of Biological Sciences"
https://edmo.seadatanet.org/report/2811,2811,"University of Bristol, School of Geographical Sciences"
https://edmo.seadatanet.org/report/2812,2812,"University of Bristol, School of Biological Sciences"
https://edmo.seadatanet.org/report/2814,2814,Project Management Support Services Limited
https://edmo.seadatanet.org/report/2815,2815,"Natural History Museum, Botany Department"
https://edmo.seadatanet.org/report/2817,2817,"University of St Andrews, School of Biology"
https://edmo.seadatanet.org/report/2818,2818,"University of Strathclyde, Department of Mathematics and Statistics"
https://edmo.seadatanet.org/report/2819,2819,Institute for Systems Biology
https://edmo.seadatanet.org/report/282,282,"Athens School of Hygiene, Microbiology Department "
https://edmo.seadatanet.org/report/2820,2820,Leibniz-Institute for Tropospheric Research
https://edmo.seadatanet.org/report/2821,2821,"Deutsches Elektronen-Synchrotron, Elementary Particle Theory Group, Zeuthen"
https://edmo.seadatanet.org/report/2822,2822,"Spanish Society for the Study of the fixed Comunication through the Strait of Gibratal,"
https://edmo.seadatanet.org/report/2823,2823,Oecos
https://edmo.seadatanet.org/report/2824,2824,University of Calabria
https://edmo.seadatanet.org/report/2825,2825,UK Benthos
https://edmo.seadatanet.org/report/2826,2826,EDINA
https://edmo.seadatanet.org/report/2827,2827,Royal Society for the Protection of Birds (HQ)
https://edmo.seadatanet.org/report/2828,2828,"University of Plymouth, School of Geography, Earth and Environmental Sciences"
https://edmo.seadatanet.org/report/2829,2829,Forewind Ltd
https://edmo.seadatanet.org/report/283,283,"University of Athens, Department of Applied Physics, Laboratory of Meteorology and Oceanography "
https://edmo.seadatanet.org/report/2830,2830,SeaRoc Group Ltd
https://edmo.seadatanet.org/report/2834,2834,MeyGen Limited
https://edmo.seadatanet.org/report/2835,2835,Natural Power Consultants
https://edmo.seadatanet.org/report/2836,2836,Directorate of Fisheries
https://edmo.seadatanet.org/report/284,284,"National Centre for Scientific Research 'Demokritos', Institute of Materials Science, X-Ray Laboratory "
https://edmo.seadatanet.org/report/2840,2840,British Atmospheric Data Centre
https://edmo.seadatanet.org/report/2842,2842,"Helmholtz-Zentrum Geesthacht, Centre for Materials and Coastal Research"
https://edmo.seadatanet.org/report/2843,2843,Archaeology Data Service
https://edmo.seadatanet.org/report/2844,2844,"State Authority for Mining, Energy and Geology"
https://edmo.seadatanet.org/report/2845,2845,Finding Sanctuary
https://edmo.seadatanet.org/report/2846,2846,Irish Sea Conservation Zones
https://edmo.seadatanet.org/report/2847,2847,Net Gain: The North Sea Marine Conservation Zones Project
https://edmo.seadatanet.org/report/2848,2848,Balanced Seas
https://edmo.seadatanet.org/report/2849,2849,Royal Commission on the Ancient and Historical Monuments of Wales
https://edmo.seadatanet.org/report/285,285,"National Centre for Scientific Research 'Demokritos', Institute of Nuclear Technology, Radiation Protection, Environmental Radioactivity Laboratory "
https://edmo.seadatanet.org/report/2850,2850,North Eastern Inshore Fisheries and Conservation Authority
https://edmo.seadatanet.org/report/2851,2851,MARINElife
https://edmo.seadatanet.org/report/2853,2853,"WDC, Whale and Dolphin Conservation"
https://edmo.seadatanet.org/report/2854,2854,Astrium Services
https://edmo.seadatanet.org/report/2856,2856,Grimsby and Cleethorpes Yacht Club
https://edmo.seadatanet.org/report/2857,2857,Fugro GeoConsulting Limited
https://edmo.seadatanet.org/report/2858,2858,Hocer
https://edmo.seadatanet.org/report/2859,2859,Consulting Geologist
https://edmo.seadatanet.org/report/286,286,"National Centre for Scientific Research 'Demokritos', Institute of Physical Chemistry, Analytical Laboratory "
https://edmo.seadatanet.org/report/2860,2860,Halcrow Group Ltd
https://edmo.seadatanet.org/report/2861,2861,"National Research Council, Institute of Geosciences and Earth Resources"
https://edmo.seadatanet.org/report/2862,2862,Laboratory of Experimental Oceanology and Marine Ecology
https://edmo.seadatanet.org/report/2863,2863,"CNR, Institute for atmospheric pollution (IIA), Monterotondo"
https://edmo.seadatanet.org/report/2864,2864,University of Valencia
https://edmo.seadatanet.org/report/2865,2865,Catalan Institute for Climate Sciences
https://edmo.seadatanet.org/report/2866,2866,Mainstream Renewable Power Ltd.
https://edmo.seadatanet.org/report/2868,2868,France Electricity Company
https://edmo.seadatanet.org/report/2869,2869,LAFARGE
https://edmo.seadatanet.org/report/287,287,"Prefecture of Lesvos, Environmental Office, Environmental Laboratory "
https://edmo.seadatanet.org/report/2870,2870,GDF Suez
https://edmo.seadatanet.org/report/2871,2871,"Swiss Federal Institute of Technology, Center for Climate Systems Modeling"
https://edmo.seadatanet.org/report/2872,2872,Carbon Dioxide Information Analysis Center
https://edmo.seadatanet.org/report/2873,2873,Devon Biodiversity Records Centre
https://edmo.seadatanet.org/report/2874,2874,Water and Marine Environnement Section
https://edmo.seadatanet.org/report/2875,2875,Marseille/FOS Large Seaport
https://edmo.seadatanet.org/report/2877,2877,University of Caen
https://edmo.seadatanet.org/report/2878,2878,La Rochelle Large Seaport
https://edmo.seadatanet.org/report/2879,2879,Invertebrates Physiology Laboratory
https://edmo.seadatanet.org/report/288,288,"Hellenic Petroleum S.A., Exploration and Exploitation of Hydrocarbons Division"
https://edmo.seadatanet.org/report/2880,2880,TELECOM Bretagne
https://edmo.seadatanet.org/report/2881,2881,ENSTA Bretagne
https://edmo.seadatanet.org/report/2882,2882,Centre for the biosphere spatial studies
https://edmo.seadatanet.org/report/2883,2883,Service of French Instrumented Planes for the Environmental Research
https://edmo.seadatanet.org/report/2884,2884,University of Bordeaux
https://edmo.seadatanet.org/report/2885,2885,Bordeaux Large Seaport
https://edmo.seadatanet.org/report/2886,2886,University of Rennes II
https://edmo.seadatanet.org/report/2887,2887,"University of Rennes II, Spaces and societies laboratory"
https://edmo.seadatanet.org/report/2888,2888,Nantes/St-Nazaire Large Seaport
https://edmo.seadatanet.org/report/2889,2889,Agency for Environment and Energy Management
https://edmo.seadatanet.org/report/289,289,"Agricultural University of Athens, Faculty of Animal Production, Laboratory of Applied Hydrobiology "
https://edmo.seadatanet.org/report/2890,2890,Maritime Institute for Prevention
https://edmo.seadatanet.org/report/2891,2891,Comite Regional des Peches Maritimes de Basse Normandie
https://edmo.seadatanet.org/report/2892,2892,Dunkirk Large Seaport
https://edmo.seadatanet.org/report/2893,2893,The Rhone-Mediterranean and Corsica Water Agency
https://edmo.seadatanet.org/report/2894,2894,General Department for Research and Innovation
https://edmo.seadatanet.org/report/2895,2895,French National Center for Scientific Research (head office)
https://edmo.seadatanet.org/report/2896,2896,Atomic Energy and Alternative Energy Commission (headquarter)
https://edmo.seadatanet.org/report/2897,2897,"CNRS, National Institute of Sciences of the Universe"
https://edmo.seadatanet.org/report/2899,2899,French Agricultural Research Centre for International Development
https://edmo.seadatanet.org/report/29,29,"Met Office, Exeter"
https://edmo.seadatanet.org/report/290,290,"Aristotelian University of Thessaloniki, Department of Chemistry, Laboratory of Analytical Chemistry "
https://edmo.seadatanet.org/report/2900,2900,"CNRS, Institute of Ecology and Environnement"
https://edmo.seadatanet.org/report/2901,2901,Institute of Human and Social Sciences
https://edmo.seadatanet.org/report/2902,2902,ROUEN Large Seaport
https://edmo.seadatanet.org/report/2903,2903,National Institute for Research in Computer and Control Sciences
https://edmo.seadatanet.org/report/2904,2904,IXBLUE SAS FRANCE (IXSEA)
https://edmo.seadatanet.org/report/2905,2905,SODENA SAS
https://edmo.seadatanet.org/report/2906,2906,CGGVeritas
https://edmo.seadatanet.org/report/2908,2908,National Institute of Geography
https://edmo.seadatanet.org/report/2909,2909,Haute-Normandie Region
https://edmo.seadatanet.org/report/291,291,"Aristotelian University of Thessaloniki, School of Veterinary Medicine, Laboratory of Ecology and Protection of the Environment "
https://edmo.seadatanet.org/report/2910,2910,Côte d'Opale Coastal University
https://edmo.seadatanet.org/report/2914,2914,Foundation For Science And Technology
https://edmo.seadatanet.org/report/2915,2915,Hebridean Whale and Dolphin Trust
https://edmo.seadatanet.org/report/2916,2916,"National Research Council, Institute of Atmospheric Sciences and Climate, Bologna"
https://edmo.seadatanet.org/report/2917,2917,"University of Rome, Earth Science Department"
https://edmo.seadatanet.org/report/2918,2918,"National Research Council, Institute of Environmental Geology and Geoengineering"
https://edmo.seadatanet.org/report/2919,2919,University of Western Brittany
https://edmo.seadatanet.org/report/292,292,"Aristotelian University of Thessaloniki, Department of Chemistry, Laboratory of Environmental Pollution Control "
https://edmo.seadatanet.org/report/2920,2920,"Marine Institute, University of Plymouth"
https://edmo.seadatanet.org/report/2921,2921,Institut of Earth Physics of Strasbourg
https://edmo.seadatanet.org/report/2922,2922,University of Plymouth
https://edmo.seadatanet.org/report/2923,2923,"Royal Holloway, University of London"
https://edmo.seadatanet.org/report/2924,2924,University of Portsmouth
https://edmo.seadatanet.org/report/2925,2925,"University of Portsmouth, Centre for the Economics and Management of Aquatic Resources"
https://edmo.seadatanet.org/report/2926,2926,"University of Kent, Durrell Institute of Conservation and Ecology"
https://edmo.seadatanet.org/report/2927,2927,Subacoustech Environmental Ltd.
https://edmo.seadatanet.org/report/2929,2929,Education Through Expeditions
https://edmo.seadatanet.org/report/293,293,"AEMET, State Meteorological Agency "
https://edmo.seadatanet.org/report/2930,2930,"Biodiversity, Genes and Communities"
https://edmo.seadatanet.org/report/2931,2931,"University of York, Environment Department"
https://edmo.seadatanet.org/report/2932,2932,"University of the Highlands and Islands, Environmental Research Institute"
https://edmo.seadatanet.org/report/2933,2933,"University College London, Department of Geography"
https://edmo.seadatanet.org/report/2937,2937,Massachusetts Institute of Technology Department of Civil and Environmental Engineering
https://edmo.seadatanet.org/report/2939,2939,"University of Nottingham, Institute of Infection, Immunity and Inflammation"
https://edmo.seadatanet.org/report/294,294,Museum of Natural Science of Tenerife
https://edmo.seadatanet.org/report/2940,2940,"London Metropolitan University, Faculty of Life Sciences"
https://edmo.seadatanet.org/report/2944,2944,"University of New Hampshire, Department of Zoology"
https://edmo.seadatanet.org/report/2945,2945,"University of Leicester, Department of Biology"
https://edmo.seadatanet.org/report/2947,2947,Helmholtz Centre for Ocean Research Kiel
https://edmo.seadatanet.org/report/2948,2948,Centre for Marine and Atmospheric Sciences
https://edmo.seadatanet.org/report/2949,2949,"University of Aberdeen, Institute of Biological and Environmental Sciences"
https://edmo.seadatanet.org/report/295,295,"Aristotelian University of Thessaloniki, Laboratory of Hydraulics "
https://edmo.seadatanet.org/report/2950,2950,Queen Mary University of London School of Biological and Chemical Sciences
https://edmo.seadatanet.org/report/2951,2951,Fraunhofer Institute for Wind Energy and Energy System
https://edmo.seadatanet.org/report/2953,2953,"University of Maine, School of Marine Sciences"
https://edmo.seadatanet.org/report/2954,2954,"University of York, Department of Chemistry"
https://edmo.seadatanet.org/report/2955,2955,"University of Leicester, Department of Chemistry"
https://edmo.seadatanet.org/report/2956,2956,"University of Leeds, School of Chemistry"
https://edmo.seadatanet.org/report/2959,2959,"Oregon State University, Department of Botany and Plant Pathology"
https://edmo.seadatanet.org/report/296,296,"Aristotelian University of Thessaloniki, Medical Faculty, School of Health Sciences, Laboratory of Hygiene "
https://edmo.seadatanet.org/report/2960,2960,Nederlands Instituut voor Onderzoek der Zee (Yerseke)
https://edmo.seadatanet.org/report/2961,2961,HiDef Aerial Surveying Limited
https://edmo.seadatanet.org/report/2962,2962,ScottishPower Renewables
https://edmo.seadatanet.org/report/2963,2963,East Anglia Offshore Wind Limited
https://edmo.seadatanet.org/report/2964,2964,Intertek METOC
https://edmo.seadatanet.org/report/2965,2965,Aquapharm Biodiscovery
https://edmo.seadatanet.org/report/2966,2966,"Council for Scientific and Industrial Research Natural Resources and Environment, Pretoria"
https://edmo.seadatanet.org/report/2967,2967,New Zealand Defence Technology Agency
https://edmo.seadatanet.org/report/297,297,Escuela de Acuicultura Marismas del Piedras
https://edmo.seadatanet.org/report/2972,2972,University of Cambridge Department of Chemistry
https://edmo.seadatanet.org/report/2974,2974,Ifremer Station de Concarneau
https://edmo.seadatanet.org/report/2975,2975,"Mediterranean Institute of Oceanography, La Seyne sur Mer"
https://edmo.seadatanet.org/report/2976,2976,"Oceanic and Continental Environments and Paleoenvironments, Talence"
https://edmo.seadatanet.org/report/2977,2977,SMart Wind Limited
https://edmo.seadatanet.org/report/2978,2978,Institute of Earth Sciences of Paris
https://edmo.seadatanet.org/report/2979,2979,Task Group for the Extension of the Continental Shelf
https://edmo.seadatanet.org/report/298,298,"IEO-CSIC, Oceanographic Centre of Canary Island"
https://edmo.seadatanet.org/report/2980,2980,Northwestern Inshore Fisheries and Conservation Authority
https://edmo.seadatanet.org/report/2981,2981,Northumberland Inshore Fisheries and Conservation Authority
https://edmo.seadatanet.org/report/2982,2982,Eastern Inshore Fisheries and Conservation Authority
https://edmo.seadatanet.org/report/2983,2983,Kent and Essex Inshore Fisheries and Conservation Authority
https://edmo.seadatanet.org/report/2984,2984,Sussex Inshore Fisheries and Conservation Authority
https://edmo.seadatanet.org/report/2985,2985,Southern Inshore Fisheries and Conservation Authority
https://edmo.seadatanet.org/report/2986,2986,Devon and Severn Inshore Fisheries and Conservation Authority
https://edmo.seadatanet.org/report/2987,2987,Cornwall Inshore Fisheries and Conservation Authority
https://edmo.seadatanet.org/report/2988,2988,"EMU Limited, Head Office"
https://edmo.seadatanet.org/report/2989,2989,"EMU Ltd, Operations"
https://edmo.seadatanet.org/report/299,299,"Aristotelian University of Thessaloniki, School of Veterinary Medicine, Laboratory of Ichthyology and Fish Pathology "
https://edmo.seadatanet.org/report/2990,2990,Boston University Department of Earth Sciences
https://edmo.seadatanet.org/report/2991,2991,"University of California, Santa Barbara, Department of Ecology, Evolution and Marine Biology"
https://edmo.seadatanet.org/report/2992,2992,University of Southern Mississippi Department of Marine Science
https://edmo.seadatanet.org/report/2993,2993,Instituto Nacional de Pesquisas Espaciais
https://edmo.seadatanet.org/report/2994,2994,"Centre for Ecology and Conservation, University of Exeter"
https://edmo.seadatanet.org/report/2995,2995,Scottish Government
https://edmo.seadatanet.org/report/2996,2996,Optimised Environments ltd
https://edmo.seadatanet.org/report/2997,2997,ConWx ApS
https://edmo.seadatanet.org/report/2998,2998,"Durham University, Department of Archaeology, Archaeological Services"
https://edmo.seadatanet.org/report/2999,2999,State Authority of Geology for Lower Saxony
https://edmo.seadatanet.org/report/3,3,"Culterty Field Station, University of Aberdeen"
https://edmo.seadatanet.org/report/300,300,"Aristotelian University of Thessaloniki, Physical Geography Department, Laboratory of Remote Sensing "
https://edmo.seadatanet.org/report/3000,3000,Federal Waterways Engineering and Research Institute
https://edmo.seadatanet.org/report/3001,3001,Steinfeld und Partner
https://edmo.seadatanet.org/report/3002,3002,Waterways and Shipping Board Emden
https://edmo.seadatanet.org/report/3003,3003,Fugro Consult
https://edmo.seadatanet.org/report/3006,3006,SSE Renewables
https://edmo.seadatanet.org/report/3007,3007,Aquatic Survey & Monitoring Ltd.
https://edmo.seadatanet.org/report/3008,3008,RPS Energy
