uri,code,name
https://edmo.seadatanet.org/report/4367,4367,"Griffith University, Australian Rivers Institute"
https://edmo.seadatanet.org/report/4369,4369,"University of Groningen, Faculty of Mathematics and Natural Sciences"
https://edmo.seadatanet.org/report/4370,4370,University of Zurich
https://edmo.seadatanet.org/report/4371,4371,"University of Zurich, Anthropological Institute and Museum "
https://edmo.seadatanet.org/report/4372,4372,Fraunhofer Institute for Molecular Biology and Applied Ecology
https://edmo.seadatanet.org/report/4373,4373,"Landesuntersuchungsamt für Chemie, Hygiene und Veterinärmedizin"
https://edmo.seadatanet.org/report/4374,4374,Environmental Specimen Bank
https://edmo.seadatanet.org/report/4375,4375,"National University of Colombia, Department of Geosciences"
https://edmo.seadatanet.org/report/4376,4376,Research Federation Environment Society 
https://edmo.seadatanet.org/report/4377,4377,"Birkbeck, University of London, Department of Earth and Planetary Sciences"
https://edmo.seadatanet.org/report/4378,4378,Schmidt Ocean Institute
https://edmo.seadatanet.org/report/4379,4379,Rio Tinto Alcan
https://edmo.seadatanet.org/report/4380,4380,Great Barrier Reef Foundation
https://edmo.seadatanet.org/report/4382,4382,AHTI Group
https://edmo.seadatanet.org/report/4383,4383,Arctic Biological Station
https://edmo.seadatanet.org/report/4384,4384,Freshwater Institute
https://edmo.seadatanet.org/report/4385,4385,"Cape Breton University, Bras d’Or Institute for Ecosystem Research"
https://edmo.seadatanet.org/report/4386,4386,"Canada Centre for Inland Waters, Bayfield Laboratory for Marine Science and Surveys"
https://edmo.seadatanet.org/report/4387,4387,EIG EUMETNET
https://edmo.seadatanet.org/report/4389,4389,The Seahorse Trust
https://edmo.seadatanet.org/report/4390,4390,Tasmanian Partnership for Advanced Computing
https://edmo.seadatanet.org/report/4391,4391,ACAP Humber Arm Inc.
https://edmo.seadatanet.org/report/4392,4392,"Canadian Wildlife Service, Atlantic Region"
https://edmo.seadatanet.org/report/4393,4393,"Canada Centre for Inland Waters, Bayfield Institute"
https://edmo.seadatanet.org/report/4394,4394,"Meteorology and Oceanography Centre, East Coast"
https://edmo.seadatanet.org/report/4395,4395,"Meteorology and Oceanography Centre, West Coast"
https://edmo.seadatanet.org/report/4396,4396,Engineering Technology Applications Ltd
https://edmo.seadatanet.org/report/4399,4399,Brookhaven National Laboratory
https://edmo.seadatanet.org/report/44,44,Scottish Association for Marine Science
https://edmo.seadatanet.org/report/440,440,"IRD, Centre de Bretagne"
https://edmo.seadatanet.org/report/4400,4400,Brooklyn College
https://edmo.seadatanet.org/report/4401,4401,Bureau of Land Management
https://edmo.seadatanet.org/report/4402,4402,California Cooperative Oceanic Fisheries Investigations
https://edmo.seadatanet.org/report/4407,4407,College of the Atlantic
https://edmo.seadatanet.org/report/4409,4409,Energy Resources Company
https://edmo.seadatanet.org/report/441,441,"Ifremer, DYNECO, PELAGOS - Laboratoire d'Ecologie Pelagique"
https://edmo.seadatanet.org/report/4413,4413,Knolls Atomic Power Laboratory
https://edmo.seadatanet.org/report/4415,4415,Marine Resources Research Institute
https://edmo.seadatanet.org/report/4421,4421,"Ocean Resources & Ecosystems Program, Cornell University"
https://edmo.seadatanet.org/report/4422,4422,State of Alaska
https://edmo.seadatanet.org/report/4423,4423,State of North Carolina
https://edmo.seadatanet.org/report/4424,4424,Texas Instruments
https://edmo.seadatanet.org/report/4427,4427,United States Department of Commerce
https://edmo.seadatanet.org/report/4428,4428,United States Environmental Protection Agency
https://edmo.seadatanet.org/report/4429,4429,University of Houston
https://edmo.seadatanet.org/report/443,443,"Université Libre de Bruxelles, Ecology of Aquatic systems"
https://edmo.seadatanet.org/report/4430,4430,University of Wisconsin-Milwaukee
https://edmo.seadatanet.org/report/4433,4433,Center for Aquatic Sciences at Adventure Aquarium
https://edmo.seadatanet.org/report/4434,4434,Cliffs Natural Resources
https://edmo.seadatanet.org/report/4435,4435,International Risk Consultants Inc
https://edmo.seadatanet.org/report/4436,4436,Jacobs Engineering Group Inc.
https://edmo.seadatanet.org/report/4437,4437,Marine Conservation Science Institute
https://edmo.seadatanet.org/report/4438,4438,The Nature Conservancy
https://edmo.seadatanet.org/report/4439,4439,Ocean Biogeographic Information System USA
https://edmo.seadatanet.org/report/444,444,"Ghent University, Laboratory of Physical Geography, Research Unit of Marine and Coastal Geomorphology"
https://edmo.seadatanet.org/report/4440,4440,Oceanweather Inc.
https://edmo.seadatanet.org/report/4441,4441,Sherbrooke University
https://edmo.seadatanet.org/report/4442,4442,"Flinders University, School of Biological Sciences"
https://edmo.seadatanet.org/report/4443,4443,"National Climate Change Adaptation Research Facility, Griffith University"
https://edmo.seadatanet.org/report/4444,4444,"University of Toulouse III, Ecolab"
https://edmo.seadatanet.org/report/4445,4445,Bibby HydroMap Ltd
https://edmo.seadatanet.org/report/4446,4446,AquaBiota Water Research
https://edmo.seadatanet.org/report/4447,4447,University of Iceland
https://edmo.seadatanet.org/report/4448,4448,Institute for Research in Economics and Business Administration
https://edmo.seadatanet.org/report/4449,4449,University of Potsdam
https://edmo.seadatanet.org/report/4450,4450,Byrd Polar and Climate Research
https://edmo.seadatanet.org/report/4451,4451,"University of British Columbia, Department of Mathematics"
https://edmo.seadatanet.org/report/4452,4452,"University of British Columbia, Department of Forest Resources Management"
https://edmo.seadatanet.org/report/4453,4453,Project Seahorse
https://edmo.seadatanet.org/report/4454,4454,"Brock University, Department of Economics"
https://edmo.seadatanet.org/report/4455,4455,University of Hull
https://edmo.seadatanet.org/report/4456,4456,"University of Hull, School of Biological, Biomedical and Environmental Sciences"
https://edmo.seadatanet.org/report/4458,4458,Cooperative Institute for Marine and Atmospheric Studies
https://edmo.seadatanet.org/report/4459,4459,Cooperative Institute for Meteorological Satellite Studies
https://edmo.seadatanet.org/report/4460,4460,"University of Washington, School of Aquatic and Fishery Sciences"
https://edmo.seadatanet.org/report/4461,4461,School of Environmental and Forest Sciences
https://edmo.seadatanet.org/report/4462,4462,WM School of Marine Science at Virginia Institute of Marine Science
https://edmo.seadatanet.org/report/4463,4463,Iowa State University
https://edmo.seadatanet.org/report/4464,4464,"Iowa State University, Department of Economics"
https://edmo.seadatanet.org/report/4465,4465,"Ecology, Evolution, and Environmental Biology"
https://edmo.seadatanet.org/report/4466,4466,International Research Institute for Climate and Society
https://edmo.seadatanet.org/report/4467,4467,"University of California, Los Angeles, Department of Ecology and Evolutionary Biology"
https://edmo.seadatanet.org/report/4468,4468,Florida International University
https://edmo.seadatanet.org/report/4469,4469,"Florida International University, Department of Biological Sciences"
https://edmo.seadatanet.org/report/447,447,"Risoe National Laboratory, Technical University of Denmark, Radiation Research Department, Radioecology"
https://edmo.seadatanet.org/report/4470,4470,"Florida International University, School of Environment, Arts and Society"
https://edmo.seadatanet.org/report/4471,4471,Romberg Tiburon Center for Environmental Studies
https://edmo.seadatanet.org/report/4472,4472,Georgetown University
https://edmo.seadatanet.org/report/4473,4473,"University of Illinois at Chicago, Department of Biological Sciences"
https://edmo.seadatanet.org/report/4474,4474,Halmos College of Natural Sciences and Oceanography
https://edmo.seadatanet.org/report/4475,4475,The University of Texas at Austin
https://edmo.seadatanet.org/report/4476,4476,"National Marine Fisheries Service, Mississippi Laboratories, Pascagoula Facility"
https://edmo.seadatanet.org/report/4477,4477,Danish Energy Agency
https://edmo.seadatanet.org/report/4478,4478,OceanSITES Project Office
https://edmo.seadatanet.org/report/4479,4479,Federal Agency for Cartography and Geodesy
https://edmo.seadatanet.org/report/448,448,"Ghent University, Faculty of Sciences, Department of Biology, Laboratory of Botany, Section Phycology, Algology"
https://edmo.seadatanet.org/report/4480,4480,Tropical Marine Ecology of the Pacific and Indian Oceans (Saint-Denis)
https://edmo.seadatanet.org/report/4481,4481,Ministry of Environmental Protection and Regional Development
https://edmo.seadatanet.org/report/4482,4482,Entropie
https://edmo.seadatanet.org/report/4486,4486,"Marine Biodiversity, Exploitation and Conservation (Sète)"
https://edmo.seadatanet.org/report/4487,4487,Ocean Tracking Network
https://edmo.seadatanet.org/report/4488,4488,University of Exeter Department of Geography
https://edmo.seadatanet.org/report/4489,4489,"British Geological Survey, Edinburgh"
https://edmo.seadatanet.org/report/449,449,"Ghent University, Faculty of Sciences, Department of Biology, Marine Biology Section"
https://edmo.seadatanet.org/report/4491,4491,Pelagis Observatory
https://edmo.seadatanet.org/report/4492,4492,"Ben-Gurion University of the Negev, Faculty of Natural Sciences, Geological And Environmental Sciences"
https://edmo.seadatanet.org/report/4493,4493,"Umea University, Biochemical laboratory, Department of chemistry"
https://edmo.seadatanet.org/report/4494,4494,"IVL Swedish Environmental Research Institute, Goteborg"
https://edmo.seadatanet.org/report/4495,4495,Research Group Estuarine and Coastal Areas
https://edmo.seadatanet.org/report/4496,4496,Oceanic and Continental Environments and Paleoenvironments
https://edmo.seadatanet.org/report/4497,4497,Bio-Littoral
https://edmo.seadatanet.org/report/4498,4498,Normand Littoral Monitoring Unit
https://edmo.seadatanet.org/report/4499,4499,Agency for Research and Valorization Marines
https://edmo.seadatanet.org/report/45,45,Marine Biological Association of the United Kingdom
https://edmo.seadatanet.org/report/4500,4500,"Ifremer, Resources Environment Laboratory Northern Brittany"
https://edmo.seadatanet.org/report/4501,4501,"Université de Liège, Underwater research and oceanographic station"
https://edmo.seadatanet.org/report/4502,4502,TBM Environment
https://edmo.seadatanet.org/report/4503,4503,Eco Laboratory geochemistry Benthic Environments
https://edmo.seadatanet.org/report/4504,4504,"Research Group Estuarine and Coastal Areas, Picardie"
https://edmo.seadatanet.org/report/4505,4505,Institute of Earth Science
https://edmo.seadatanet.org/report/4506,4506,Invertebrate Physiology Laboratory (Argenton)
https://edmo.seadatanet.org/report/4507,4507,"Phaxas, Expertise Of Marine Fauna"
https://edmo.seadatanet.org/report/4508,4508,Jan De Nul N.V. (Head Office)
https://edmo.seadatanet.org/report/4509,4509,Bohlen & Doyen GmbH
https://edmo.seadatanet.org/report/451,451,"University of Liège, Laboratory of Oceanology, Chemical Oceanography Unit"
https://edmo.seadatanet.org/report/4510,4510,"ALS Scandinavia, Lulea"
https://edmo.seadatanet.org/report/4511,4511,Sheringham Shoal Offshore Wind Farm
https://edmo.seadatanet.org/report/4512,4512,Sydney Water
https://edmo.seadatanet.org/report/4513,4513,"Mediterranean Institute of Oceanography, Noumea"
https://edmo.seadatanet.org/report/4514,4514,Centre for Maritime Research and Experimentation
https://edmo.seadatanet.org/report/4515,4515,ENSTA Paristech
https://edmo.seadatanet.org/report/4516,4516,Marine Robotics Innovation centre
https://edmo.seadatanet.org/report/4517,4517,"Department of Agriculture, Environment and Rural Affairs"
https://edmo.seadatanet.org/report/4518,4518,Natural England – Marine Evidence Team
https://edmo.seadatanet.org/report/4520,4520,"Meteo France, Schapi"
https://edmo.seadatanet.org/report/4521,4521,Departmental Divisions of the Territories and the Sea
https://edmo.seadatanet.org/report/4522,4522,Laboratory of study of the marine bio-indicators
https://edmo.seadatanet.org/report/4523,4523,"Ifremer, Environmental Resources Laboratory Morbihan, Pays de la Loire (Nantes)"
https://edmo.seadatanet.org/report/4524,4524,Departmental Laboratory of Drôme
https://edmo.seadatanet.org/report/4525,4525,Labocea
https://edmo.seadatanet.org/report/4526,4526,CIRAD
https://edmo.seadatanet.org/report/4527,4527,Blue Ocean Monitoring Pty Ltd
https://edmo.seadatanet.org/report/4528,4528,National Institute for Environmental Studies 
https://edmo.seadatanet.org/report/4529,4529,ARCADIS
https://edmo.seadatanet.org/report/4530,4530,"COGEA SRL, Business Management Consultants"
https://edmo.seadatanet.org/report/4531,4531,Eaufrance
https://edmo.seadatanet.org/report/4532,4532,"Cerema, Technical Direction Water, Sea And Rivers (Bonneuil)"
https://edmo.seadatanet.org/report/4533,4533,"Centre for Studies on Risks, Environment, Mobility and Urban Planning - Technical directorate Risks, waters and sea (Plouzane)"
https://edmo.seadatanet.org/report/4534,4534,"Leibniz Institute, German Collection of Microorganisms and Cell Cultures"
https://edmo.seadatanet.org/report/4535,4535,Helmholtz Centre for Infection Research
https://edmo.seadatanet.org/report/4536,4536,Laboratory for Ocean Physics and Satellite remote
https://edmo.seadatanet.org/report/4537,4537,ORION
https://edmo.seadatanet.org/report/4538,4538,Colin Moore
https://edmo.seadatanet.org/report/4539,4539,University of Sheffield Department of Geography
https://edmo.seadatanet.org/report/4540,4540,"Ocean University of China, Department of Ocean Engineering"
https://edmo.seadatanet.org/report/4541,4541,University of Cambridge Department of Physics
https://edmo.seadatanet.org/report/4542,4542,XYZH Hydrographic
https://edmo.seadatanet.org/report/4543,4543,"Environment Agency, National Laboratory Service, Leeds Laboratory"
https://edmo.seadatanet.org/report/4544,4544,"Environment Agency, National Laboratory Service, Nottingham Laboratory"
https://edmo.seadatanet.org/report/4545,4545,"Environment Agency, National Laboratory Service, Llanelli Laboratory"
https://edmo.seadatanet.org/report/4546,4546,Natural Resources Wales Laboratory
https://edmo.seadatanet.org/report/4547,4547,Environment Agency South West Regional Office
https://edmo.seadatanet.org/report/4548,4548,Environment Agency North West Regional Office
https://edmo.seadatanet.org/report/4549,4549,Environments for People
https://edmo.seadatanet.org/report/4550,4550,Clinton Marine Survey AB
https://edmo.seadatanet.org/report/4551,4551,Environment Agency South East Regional Office
https://edmo.seadatanet.org/report/4552,4552,Environment Agency Solent and South Downs Area Office
https://edmo.seadatanet.org/report/4553,4553,"Scottish Environment Protection Agency, Aberdeen Office"
https://edmo.seadatanet.org/report/4554,4554,"Scottish Environment Protection Agency, Angus Smith Building"
https://edmo.seadatanet.org/report/4556,4556,"Scottish Environment Protection Agency, Perth (Strathearn House) Office"
https://edmo.seadatanet.org/report/4557,4557,"Deep BV, Hydrography and Geophysics"
https://edmo.seadatanet.org/report/4558,4558,The Marine Environment Monitoring and Assessment National database
https://edmo.seadatanet.org/report/4559,4559,University of Innsbruck
https://edmo.seadatanet.org/report/4560,4560,The Council for Geoscience
https://edmo.seadatanet.org/report/4561,4561,"Acadia University, Acadia Centre for Estuarine Research"
https://edmo.seadatanet.org/report/4562,4562,"Acadia University, Department of Biology"
https://edmo.seadatanet.org/report/4565,4565,Pöyry Finland
https://edmo.seadatanet.org/report/4569,4569,"Natural Resources Institute Finland, Turku Laboratory"
https://edmo.seadatanet.org/report/457,457,Agency for Water and Nature Management
https://edmo.seadatanet.org/report/4570,4570,The Association for Water and Environment of Western Uusimaa
https://edmo.seadatanet.org/report/4572,4572,Kala- ja vesitutkimus Ltd
https://edmo.seadatanet.org/report/4574,4574,"University of Bolton, Bolton Business School"
https://edmo.seadatanet.org/report/4575,4575,Siem Offshore Contractors GmbH
https://edmo.seadatanet.org/report/4576,4576,Baker Consultants
https://edmo.seadatanet.org/report/4577,4577,Maritime Archaeology Ltd
https://edmo.seadatanet.org/report/4578,4578,Institute of Microbiology and Genetics
https://edmo.seadatanet.org/report/4579,4579,Laboratory of Oceanology and Geosciences
https://edmo.seadatanet.org/report/4580,4580,"MARine Biodiversity, Exploitation and Conservation, UMR, SAINTE-CLOTILDE"
https://edmo.seadatanet.org/report/4581,4581,"Uniper Technologies Limited, Technology Centre "
https://edmo.seadatanet.org/report/4582,4582,"Historic England, London"
https://edmo.seadatanet.org/report/4583,4583,"GEOxyz, United Kingdom Office"
https://edmo.seadatanet.org/report/4584,4584,"Department of Labour Inspection, Ministry of Labour and Social Insurance"
https://edmo.seadatanet.org/report/4585,4585,EuroGOOS AISBL
https://edmo.seadatanet.org/report/4586,4586,Greek Research and Technology Network
https://edmo.seadatanet.org/report/4587,4587,The German Climate Computing Center
https://edmo.seadatanet.org/report/4588,4588,OceanOPS
https://edmo.seadatanet.org/report/4589,4589,Animal and Plant Health Agency
https://edmo.seadatanet.org/report/4590,4590,"St. Francis Xavier University, Department of Biology"
https://edmo.seadatanet.org/report/4591,4591,"Memorial University of Newfoundland, Department of Biology"
https://edmo.seadatanet.org/report/4592,4592,"CNRS, Labo Interuniversitaire des Systèmes Atmosphériques "
https://edmo.seadatanet.org/report/4593,4593,Aberdeen Offshore Wind Farm Limited
https://edmo.seadatanet.org/report/4594,4594,UTEC (Corporate Headquarters)
https://edmo.seadatanet.org/report/4595,4595,"University of Bergen, Geophysical Institute"
https://edmo.seadatanet.org/report/4596,4596,"University of Gothenburg, Department of Chemistry"
https://edmo.seadatanet.org/report/4597,4597,"University of New Hampshire, Institute for the Study of Earth, Oceans & Space"
https://edmo.seadatanet.org/report/4598,4598,"Princeton University, Department of Atmospheric and Oceanic Sciences"
https://edmo.seadatanet.org/report/4599,4599,"University of Hawaii, Department of Oceanography"
https://edmo.seadatanet.org/report/46,46,Permanent Service for Mean Sea Level
https://edmo.seadatanet.org/report/4600,4600,"University of Montana, Department of Chemistry"
https://edmo.seadatanet.org/report/4601,4601,Hawai‘i Pacific University
https://edmo.seadatanet.org/report/4602,4602,NOAA Earth System Research Laboratory
https://edmo.seadatanet.org/report/4603,4603,"University of Otago, Department of Chemistry"
https://edmo.seadatanet.org/report/4604,4604,"National Research Institute for Fisheries Science, Fisheries Research Agency"
https://edmo.seadatanet.org/report/4606,4606,"Ifremer, Environment Resources Laboratory Provence Azur Corsica (La Seyne-sur-Mer)"
https://edmo.seadatanet.org/report/4607,4607,"Ifremer, Underwater Systems Unit (La Seyne)"
https://edmo.seadatanet.org/report/4609,4609,Directorate-General  for Territorial Development
https://edmo.seadatanet.org/report/4610,4610,Sea Directorate of Guyana
https://edmo.seadatanet.org/report/4611,4611,Guadeloupe Large Seaport
https://edmo.seadatanet.org/report/4612,4612,Pau and Pays de l'Adour University
https://edmo.seadatanet.org/report/4613,4613,Associated Norman Ports
https://edmo.seadatanet.org/report/4614,4614,ERIC Euro-Argo
https://edmo.seadatanet.org/report/4615,4615,DREAL Nord-Pas-de-Calais
https://edmo.seadatanet.org/report/4616,4616,Bureau of Enquiry and Analysis for Civil Aviation Safety
https://edmo.seadatanet.org/report/4617,4617,DREAL Languedoc-Roussillon-Midi-Pyrénées
https://edmo.seadatanet.org/report/4618,4618,Ecole Centrale Nantes
https://edmo.seadatanet.org/report/4619,4619,Calluna AB
https://edmo.seadatanet.org/report/4620,4620,Svenska ALcontrol AB
https://edmo.seadatanet.org/report/4621,4621,"Dalhousie University, Department of Earth Sciences"
https://edmo.seadatanet.org/report/4622,4622,"The Rooms Corporation of Newfoundland and Labrador, Provincial Museum Division"
https://edmo.seadatanet.org/report/4623,4623,HydroGIS AB
https://edmo.seadatanet.org/report/4624,4624,Naturvatten Roslagen AB
https://edmo.seadatanet.org/report/4625,4625,Mediterranean Institute Of Oceanography (Toulon)
https://edmo.seadatanet.org/report/4626,4626,DEAL Guyana
https://edmo.seadatanet.org/report/4627,4627,DTAM St-Pierre et Miquelon
https://edmo.seadatanet.org/report/4628,4628,"Collection & Location by Satellite, America"
https://edmo.seadatanet.org/report/4629,4629,"Naval Research Laboratory, Marine Meteorology Division"
https://edmo.seadatanet.org/report/463,463,Maersk Oil and Gas AS
https://edmo.seadatanet.org/report/4632,4632,"Centre for Atmospheric and Oceanic Sciences, Indian Institute of Science"
https://edmo.seadatanet.org/report/4636,4636,Cubic-i Ltd.
https://edmo.seadatanet.org/report/4637,4637,South African National Antarctic Programme
https://edmo.seadatanet.org/report/4638,4638,Niels Bohr Institute
https://edmo.seadatanet.org/report/464,464,"Fisheries Laboratory, Faroe Islands"
https://edmo.seadatanet.org/report/4640,4640,"First Institute of Oceanography, Ministry of Natural Resources"
https://edmo.seadatanet.org/report/4642,4642,"National Research Council Canada, Atlantic Regional Laboratory"
https://edmo.seadatanet.org/report/4643,4643,"Maritime Spatial Planning (Department of Housing, Planning, and Local Government)"
https://edmo.seadatanet.org/report/4645,4645,"University of Prince Edward Island, Department of Biology"
https://edmo.seadatanet.org/report/4646,4646,Titan Environmental Surveys Ltd
https://edmo.seadatanet.org/report/4647,4647,"CNR, Institute of Atmospheric Pollution Research (Florence)"
https://edmo.seadatanet.org/report/4648,4648,Scottish Fishermen’s Federation
https://edmo.seadatanet.org/report/4649,4649,University of Southampton Engineering and the Environment
https://edmo.seadatanet.org/report/465,465,"Royal Danish Administration of Navigation & Hydrography, Hydrographic Department"
https://edmo.seadatanet.org/report/4650,4650,Aalto University
https://edmo.seadatanet.org/report/4651,4651,"CSC, IT Center for Science Ltd."
https://edmo.seadatanet.org/report/4652,4652,Institut für technische und angewandte Physik GmbH
https://edmo.seadatanet.org/report/4653,4653,Geomara
https://edmo.seadatanet.org/report/4654,4654,Peel Ports Group Ltd
https://edmo.seadatanet.org/report/4655,4655,Jan De Nul Luxembourg S.A.
https://edmo.seadatanet.org/report/4656,4656,Historic Environment Scotland
https://edmo.seadatanet.org/report/4657,4657,"Dalhousie University, Department of Biology"
https://edmo.seadatanet.org/report/4658,4658,"McGill University, Department of Biology"
https://edmo.seadatanet.org/report/4659,4659,Periplus Group
https://edmo.seadatanet.org/report/466,466,"Danish Coastal Authority, Ministry of Transport and Energy"
https://edmo.seadatanet.org/report/4660,4660,"Institute of Systematics, Evolution, Biodiversity (Paris)"
https://edmo.seadatanet.org/report/4665,4665,Maritime Administration of Latvia
https://edmo.seadatanet.org/report/4666,4666,Geodetic Institute of Slovenia
https://edmo.seadatanet.org/report/4667,4667,EOMAP GmbH & Co KG
https://edmo.seadatanet.org/report/4668,4668,Danish Maritime Authority
https://edmo.seadatanet.org/report/4669,4669,"Danish Geodata Agency, Danish Hydrographic Office"
https://edmo.seadatanet.org/report/4670,4670,Coronis Computing SL
https://edmo.seadatanet.org/report/4671,4671,"Department of Geology, Geophysics and Coastal Processes, Israel Oceanographic & Limnological Research."
https://edmo.seadatanet.org/report/4672,4672,"Technological Educational Institute of Ionian Islands, School of Applied Technologies, Department of Environmental Technology and Ecology"
https://edmo.seadatanet.org/report/4673,4673,River Basin Community Elbe
https://edmo.seadatanet.org/report/4674,4674,Latvian Ornithological Society
https://edmo.seadatanet.org/report/4675,4675,"Society ""Friends of the Earth"""
https://edmo.seadatanet.org/report/4676,4676,The State Environmental Service of the Republic of Latvia
https://edmo.seadatanet.org/report/4677,4677,Laboratoire Dynamique Hydro-Sédimentaire
https://edmo.seadatanet.org/report/4678,4678,Ramboll Analytics
https://edmo.seadatanet.org/report/4680,4680,Ålands landskapsregering
https://edmo.seadatanet.org/report/4681,4681,National Museum of Underwater Archaeology
https://edmo.seadatanet.org/report/4682,4682,Kenneth Pye Associates Ltd
https://edmo.seadatanet.org/report/4684,4684,Ahma Group Rovaniemi
https://edmo.seadatanet.org/report/4685,4685,North Devon Area of Outstanding Natural Beauty 
https://edmo.seadatanet.org/report/4687,4687,Blom Aerofilms Limited
https://edmo.seadatanet.org/report/4688,4688,Gas Transmission Operator GAZ-SYSTEM S.A.
https://edmo.seadatanet.org/report/4689,4689,Geo Ingenieurservice Ost GmbH & Co. KG
https://edmo.seadatanet.org/report/469,469,"Danish Meteorological Institute, Oceanographic Section"
https://edmo.seadatanet.org/report/4690,4690,Secora AS
https://edmo.seadatanet.org/report/4691,4691,"Department of Biology, University of Bergen"
https://edmo.seadatanet.org/report/4692,4692,Ramboll Denmark A/S
https://edmo.seadatanet.org/report/4693,4693,Rohde Nielsen A/S
https://edmo.seadatanet.org/report/4694,4694,Aga Gas AB
https://edmo.seadatanet.org/report/4696,4696,Boskalis Sweden AB
https://edmo.seadatanet.org/report/4697,4697,Caliterra AB
https://edmo.seadatanet.org/report/4698,4698,Cementa AB
https://edmo.seadatanet.org/report/47,47,Plymouth Marine Laboratory
https://edmo.seadatanet.org/report/4702,4702,Gps Marinkonsult AB
https://edmo.seadatanet.org/report/4703,4703,Hydrographica
